{
  "authority_source": "authorizations/SHWP-ALL-ORG-FEDERATION-001.json",
  "checkpoint_id": "CP-SHWP-ALL-ORG-FEDERATION-001-HB15-G17",
  "checkpoint_sha256": "bc8be7f7da4306a0fce121a7ffcabfb2e435d6b58a81af910b875bf8408ab152",
  "claim_id": "SHWP-SHWP-ALL-ORG-FEDERATION-001-G17",
  "completed_transitions": [
    {
      "heartbeat_epoch": 11,
      "response_state": "BLOCKED",
      "transition_id": "FEDERATION_READY_WITH_MACHINE_BLOCKERS",
      "transition_sequence": 1
    },
    {
      "heartbeat_epoch": 12,
      "response_state": "BLOCKED",
      "transition_id": "FEDERATION_READY_WITH_MACHINE_BLOCKERS",
      "transition_sequence": 2
    },
    {
      "heartbeat_epoch": 13,
      "response_state": "BLOCKED",
      "transition_id": "FEDERATION_READY_WITH_MACHINE_BLOCKERS",
      "transition_sequence": 3
    },
    {
      "heartbeat_epoch": 14,
      "response_state": "BLOCKED",
      "transition_id": "FEDERATION_READY_WITH_MACHINE_BLOCKERS",
      "transition_sequence": 4
    },
    {
      "heartbeat_epoch": 15,
      "response_state": "BLOCKED",
      "transition_id": "FEDERATION_READY_WITH_MACHINE_BLOCKERS",
      "transition_sequence": 5
    }
  ],
  "current_state": "BLOCKED",
  "evidence_refs": [
    "StegVerse-Labs/Site#234",
    "control/organization-federation.json",
    "control/organization-task-registry.json",
    "control/heartbeat-subsignals.json",
    "authorizations/SHWP-ALL-ORG-FEDERATION-001.json",
    "workers/organization_federation_readiness_worker.py",
    "receipts/organization-federation/SHWP-ALL-ORG-FEDERATION-001.json",
    "receipts/worker-mutation-scope/SHWP-ALL-ORG-FEDERATION-001-HB11-G17-610ed9983c4b0466.json",
    "checkpoints/workers/SHWP-ALL-ORG-FEDERATION-001/HB11-G17.json",
    "receipts/worker-mutation-scope/SHWP-ALL-ORG-FEDERATION-001-HB12-G17-11ff1e14ff41f646.json",
    "checkpoints/workers/SHWP-ALL-ORG-FEDERATION-001/HB12-G17.json",
    "receipts/worker-mutation-scope/SHWP-ALL-ORG-FEDERATION-001-HB13-G17-06e7603206093d0c.json",
    "checkpoints/workers/SHWP-ALL-ORG-FEDERATION-001/HB13-G17.json",
    "receipts/worker-mutation-scope/SHWP-ALL-ORG-FEDERATION-001-HB14-G17-74122594f9d4e33d.json",
    "checkpoints/workers/SHWP-ALL-ORG-FEDERATION-001/HB14-G17.json",
    "receipts/worker-mutation-scope/SHWP-ALL-ORG-FEDERATION-001-HB15-G17-23081f45d54f1c5e.json"
  ],
  "execution_authority": false,
  "fencing_token": 17,
  "goal_id": "ALL-ORG-HEARTBEAT-FEDERATION-001",
  "handoff_ref": "handoffs/SHWP-ALL-ORG-FEDERATION-001.json",
  "handoff_sha256": "6674dcf3aadf35337f21ef5c88e3c165eb72cf2277d546f850a615f33585addb",
  "heartbeat_epoch": 15,
  "next_authorized_action": "On the next admitted heartbeat, reconcile all 14 organization readiness rows and persist a federation receipt; blocked rows remain machine-owned until their explicit release conditions become true.",
  "policy_version": "shwp-single-hb-v0.2",
  "resource_budget": {
    "actions_used": 5,
    "allowed_services": [],
    "external_cost_ceiling_usd": 0.0,
    "external_cost_usd": 0.0,
    "max_actions": 128,
    "max_retries": 128,
    "rate_class": "heartbeat_federation_reconciliation",
    "renewal_count": 0,
    "retries_used": 0,
    "runtime_window_beats": 256
  },
  "schema": "stegverse.worker-checkpoint/v0.1",
  "task_id": "SHWP-ALL-ORG-FEDERATION-001",
  "unresolved_work": [
    "On the next admitted heartbeat, reconcile all 14 organization readiness rows and persist a federation receipt; blocked rows remain machine-owned until their explicit release conditions become true."
  ],
  "worker_checkpoint_ref": "receipts/organization-federation/SHWP-ALL-ORG-FEDERATION-001.json",
  "worker_id": "organization-federation-readiness-worker",
  "worker_instance_id": "organization-federation-readiness-worker-HB11-G17"
}
